{
  "version": "mpgf-ledger-transaction-templates-v0.3-direct-working",
  "currency": "usd",
  "mode": "non_real_money_demo",
  "templates": [
    {
      "transaction_type": "payment_intent_created",
      "required_related_type": "mpgf_payment_intent",
      "affects_derived_B_t": false,
      "allowed_before_budget_lock": true,
      "allowed_after_budget_lock": true,
      "real_money_eligible": false,
      "debit_entries": [{ "account": "cash_received", "amount_source": "zero_or_test_amount_cents" }],
      "credit_entries": [{ "account": "contribution_revenue_or_restricted_funds", "amount_source": "zero_or_test_amount_cents" }],
      "amount_source": "payment_intent.amount_cents",
      "required_idempotency_key_source": "payment_intent.id",
      "required_audit_log": true,
      "required_approval_or_review_status": "payment_provider_test_or_real_money_gate"
    },
    {
      "transaction_type": "payment_succeeded",
      "required_related_type": "mpgf_payment_intent",
      "affects_derived_B_t": true,
      "allowed_before_budget_lock": true,
      "allowed_after_budget_lock": true,
      "real_money_eligible": false,
      "debit_entries": [{ "account": "cash_received", "amount_source": "payment_intent.amount_cents" }],
      "credit_entries": [{ "account": "contribution_revenue_or_restricted_funds", "amount_source": "payment_intent.amount_cents" }],
      "amount_source": "payment_intent.amount_cents",
      "required_idempotency_key_source": "payment_intent.provider_event_id",
      "required_audit_log": true,
      "required_approval_or_review_status": "provider_event_verified"
    },
    {
      "transaction_type": "contribution_recorded",
      "required_related_type": "mpgf_contribution",
      "affects_derived_B_t": true,
      "allowed_before_budget_lock": true,
      "allowed_after_budget_lock": false,
      "real_money_eligible": false,
      "debit_entries": [{ "account": "contribution_revenue_or_restricted_funds", "amount_source": "contribution.amount_cents" }],
      "credit_entries": [{ "account": "cycle_budget_available", "amount_source": "contribution.amount_cents" }],
      "amount_source": "contribution.amount_cents",
      "required_idempotency_key_source": "contribution.id",
      "required_audit_log": true,
      "required_approval_or_review_status": "contribution_verified"
    },
    {
      "transaction_type": "budget_locked",
      "required_related_type": "mpgf_cycle",
      "affects_derived_B_t": true,
      "allowed_before_budget_lock": true,
      "allowed_after_budget_lock": false,
      "real_money_eligible": false,
      "debit_entries": [{ "account": "cycle_budget_available", "amount_source": "cycle.available_budget_cents" }],
      "credit_entries": [{ "account": "cycle_budget_locked", "amount_source": "cycle.available_budget_cents" }],
      "amount_source": "cycle.available_budget_cents",
      "required_idempotency_key_source": "cycle.id + budget_lock_version",
      "required_audit_log": true,
      "required_approval_or_review_status": "cycle_budget_lock_approved"
    },
    {
      "transaction_type": "late_contribution_assigned_next_cycle",
      "required_related_type": "mpgf_contribution_or_pledge",
      "affects_derived_B_t": false,
      "allowed_before_budget_lock": false,
      "allowed_after_budget_lock": true,
      "real_money_eligible": false,
      "debit_entries": [{ "account": "cash_received", "amount_source": "record.amount_cents" }],
      "credit_entries": [{ "account": "carryover", "amount_source": "record.amount_cents" }],
      "amount_source": "record.amount_cents",
      "required_idempotency_key_source": "record.id + next_cycle_id",
      "required_audit_log": true,
      "required_approval_or_review_status": "next_open_cycle_assigned"
    },
    {
      "transaction_type": "refund_requested",
      "required_related_type": "mpgf_refund",
      "affects_derived_B_t": false,
      "allowed_before_budget_lock": true,
      "allowed_after_budget_lock": true,
      "real_money_eligible": false,
      "debit_entries": [{ "account": "contribution_revenue_or_restricted_funds", "amount_source": "refund.amount_cents" }],
      "credit_entries": [{ "account": "refunds_payable", "amount_source": "refund.amount_cents" }],
      "amount_source": "refund.amount_cents",
      "required_idempotency_key_source": "refund.id + requested",
      "required_audit_log": true,
      "required_approval_or_review_status": "refund_eligibility_approved"
    },
    {
      "transaction_type": "refund_succeeded",
      "required_related_type": "mpgf_refund",
      "affects_derived_B_t": false,
      "allowed_before_budget_lock": true,
      "allowed_after_budget_lock": true,
      "real_money_eligible": false,
      "debit_entries": [{ "account": "refunds_payable", "amount_source": "refund.amount_cents" }],
      "credit_entries": [{ "account": "refunds_issued", "amount_source": "refund.amount_cents" }],
      "amount_source": "refund.amount_cents",
      "required_idempotency_key_source": "refund.provider_refund_id",
      "required_audit_log": true,
      "required_approval_or_review_status": "provider_refund_verified"
    },
    {
      "transaction_type": "chargeback_received",
      "required_related_type": "mpgf_chargeback",
      "affects_derived_B_t": false,
      "allowed_before_budget_lock": true,
      "allowed_after_budget_lock": true,
      "real_money_eligible": false,
      "debit_entries": [{ "account": "chargebacks_disputed", "amount_source": "chargeback.amount_cents" }],
      "credit_entries": [{ "account": "cash_received", "amount_source": "chargeback.amount_cents" }],
      "amount_source": "chargeback.amount_cents",
      "required_idempotency_key_source": "chargeback.provider_dispute_id",
      "required_audit_log": true,
      "required_approval_or_review_status": "provider_dispute_received"
    },
    {
      "transaction_type": "chargeback_won",
      "required_related_type": "mpgf_chargeback",
      "affects_derived_B_t": false,
      "allowed_before_budget_lock": true,
      "allowed_after_budget_lock": true,
      "real_money_eligible": false,
      "debit_entries": [{ "account": "cash_received", "amount_source": "chargeback.amount_cents" }],
      "credit_entries": [{ "account": "chargebacks_disputed", "amount_source": "chargeback.amount_cents" }],
      "amount_source": "chargeback.amount_cents",
      "required_idempotency_key_source": "chargeback.provider_dispute_id + won",
      "required_audit_log": true,
      "required_approval_or_review_status": "provider_dispute_won"
    },
    {
      "transaction_type": "chargeback_lost",
      "required_related_type": "mpgf_chargeback",
      "affects_derived_B_t": false,
      "allowed_before_budget_lock": true,
      "allowed_after_budget_lock": true,
      "real_money_eligible": false,
      "debit_entries": [{ "account": "chargebacks_lost", "amount_source": "chargeback.amount_cents" }],
      "credit_entries": [{ "account": "chargebacks_disputed", "amount_source": "chargeback.amount_cents" }],
      "amount_source": "chargeback.amount_cents",
      "required_idempotency_key_source": "chargeback.provider_dispute_id + lost",
      "required_audit_log": true,
      "required_approval_or_review_status": "provider_dispute_lost"
    },
    {
      "transaction_type": "allocation_authorized",
      "required_related_type": "mpgf_allocation_run",
      "affects_derived_B_t": false,
      "allowed_before_budget_lock": false,
      "allowed_after_budget_lock": true,
      "real_money_eligible": false,
      "debit_entries": [{ "account": "cycle_budget_locked", "amount_source": "allocation.amount_cents" }],
      "credit_entries": [{ "account": "authorized_not_released", "amount_source": "allocation.amount_cents" }],
      "amount_source": "allocation.amount_cents",
      "required_idempotency_key_source": "allocation_run.id",
      "required_audit_log": true,
      "required_approval_or_review_status": "allocation_certificate_verified"
    },
    {
      "transaction_type": "tranche_released_internal",
      "required_related_type": "mpgf_tranche_release",
      "affects_derived_B_t": false,
      "allowed_before_budget_lock": false,
      "allowed_after_budget_lock": true,
      "real_money_eligible": false,
      "debit_entries": [{ "account": "authorized_not_released", "amount_source": "tranche.amount_cents" }],
      "credit_entries": [{ "account": "released_internal", "amount_source": "tranche.amount_cents" }],
      "amount_source": "tranche.amount_cents",
      "required_idempotency_key_source": "tranche.id",
      "required_audit_log": true,
      "required_approval_or_review_status": "release_approved"
    },
    {
      "transaction_type": "payout_authorized",
      "required_related_type": "mpgf_payout_authorization",
      "affects_derived_B_t": false,
      "allowed_before_budget_lock": false,
      "allowed_after_budget_lock": true,
      "real_money_eligible": false,
      "debit_entries": [{ "account": "released_internal", "amount_source": "payout_authorization.amount_cents" }],
      "credit_entries": [{ "account": "payout_authorized", "amount_source": "payout_authorization.amount_cents" }],
      "amount_source": "payout_authorization.amount_cents",
      "required_idempotency_key_source": "payout_authorization.id",
      "required_audit_log": true,
      "required_approval_or_review_status": "payout_admin_or_super_admin_plus_auditor"
    },
    {
      "transaction_type": "external_payment_recorded",
      "required_related_type": "mpgf_external_payment_evidence",
      "affects_derived_B_t": false,
      "allowed_before_budget_lock": false,
      "allowed_after_budget_lock": true,
      "real_money_eligible": false,
      "debit_entries": [{ "account": "payout_authorized", "amount_source": "external_payment.amount_cents" }],
      "credit_entries": [{ "account": "externally_paid", "amount_source": "external_payment.amount_cents" }],